{
  "version": "1",
  "openapi_url": "/openapi.json",
  "authorization_notice": "This is an inventory, not an authorization grant. Use /v1/me for actual memberships; the server rechecks every operation.",
  "items": [
    {
      "action_id": "system.mcp_discovery",
      "roles": [],
      "effect": "none",
      "effect_description": "Read only; no durable application change.",
      "intent_example": "Découvre le fournisseur d'identité configuré pour cette ressource MCP.",
      "confirmation_policy": "authorized_user_intent",
      "object_authorization": "Service checks membership, current evidence access and personal/author scope where applicable. Listed roles alone do not grant object access.",
      "method": "GET",
      "path": "/.well-known/oauth-protected-resource",
      "operation_id": "system.mcp_discovery"
    },
    {
      "action_id": "responses.create",
      "roles": [
        "owner",
        "corpus_manager",
        "contributor",
        "agent",
        "viewer"
      ],
      "effect": "personal",
      "effect_description": "Changes personal state or appends personal feedback/decision history.",
      "intent_example": "Conserve la réponse de mon companion et ses références à cet épisode.",
      "confirmation_policy": "authorized_user_intent",
      "object_authorization": "Service checks membership, current evidence access and personal/author scope where applicable. Listed roles alone do not grant object access.",
      "method": "POST",
      "path": "/v1/domains/{domain}/episodes/{episode_id}/companion-responses",
      "operation_id": "responses.create"
    },
    {
      "action_id": "responses.read",
      "roles": [
        "owner",
        "corpus_manager",
        "contributor",
        "agent",
        "viewer"
      ],
      "effect": "none",
      "effect_description": "Read only; no durable application change.",
      "intent_example": "Montre cette réponse et les preuves de l'épisode associé.",
      "confirmation_policy": "authorized_user_intent",
      "object_authorization": "Service checks membership, current evidence access and personal/author scope where applicable. Listed roles alone do not grant object access.",
      "method": "GET",
      "path": "/v1/domains/{domain}/companion-responses/{response_id}",
      "operation_id": "responses.read"
    },
    {
      "action_id": "responses.list",
      "roles": [
        "owner",
        "corpus_manager",
        "contributor",
        "agent",
        "viewer"
      ],
      "effect": "none",
      "effect_description": "Read only; no durable application change.",
      "intent_example": "Retrouve les réponses personnelles de mes companions.",
      "confirmation_policy": "authorized_user_intent",
      "object_authorization": "Service checks membership, current evidence access and personal/author scope where applicable. Listed roles alone do not grant object access.",
      "method": "GET",
      "path": "/v1/domains/{domain}/companion-responses",
      "operation_id": "responses.list"
    },
    {
      "action_id": "syntheses.create",
      "roles": [
        "owner",
        "corpus_manager",
        "contributor",
        "agent",
        "viewer"
      ],
      "effect": "synthesis",
      "effect_description": "Sends an episode question and cited excerpts to configured OpenRouter; may incur charges; records a personal response without publishing knowledge.",
      "intent_example": "Génère une réponse citée à cet épisode via OpenRouter.",
      "confirmation_policy": "explicit_user_decision",
      "object_authorization": "Service checks membership, current evidence access and personal/author scope where applicable. Listed roles alone do not grant object access.",
      "method": "POST",
      "path": "/v1/domains/{domain}/episodes/{episode_id}/syntheses",
      "operation_id": "syntheses.create"
    },
    {
      "action_id": "syntheses.read",
      "roles": [
        "owner",
        "corpus_manager",
        "contributor",
        "agent",
        "viewer"
      ],
      "effect": "none",
      "effect_description": "Read only; no durable application change.",
      "intent_example": "Montre le résultat durable de cette synthèse personnelle.",
      "confirmation_policy": "authorized_user_intent",
      "object_authorization": "Service checks membership, current evidence access and personal/author scope where applicable. Listed roles alone do not grant object access.",
      "method": "GET",
      "path": "/v1/domains/{domain}/syntheses/{ident}",
      "operation_id": "syntheses.read"
    },
    {
      "action_id": "syntheses.list",
      "roles": [
        "owner",
        "corpus_manager",
        "contributor",
        "agent",
        "viewer"
      ],
      "effect": "none",
      "effect_description": "Read only; no durable application change.",
      "intent_example": "Retrouve mes tentatives de synthèse.",
      "confirmation_policy": "authorized_user_intent",
      "object_authorization": "Service checks membership, current evidence access and personal/author scope where applicable. Listed roles alone do not grant object access.",
      "method": "GET",
      "path": "/v1/domains/{domain}/syntheses",
      "operation_id": "syntheses.list"
    },
    {
      "action_id": "models.attempts",
      "roles": [
        "owner"
      ],
      "effect": "none",
      "effect_description": "Read only; no durable application change.",
      "intent_example": "Liste mes tentatives d'extraction et leurs résultats durables.",
      "confirmation_policy": "authorized_user_intent",
      "object_authorization": "Service checks membership, current evidence access and personal/author scope where applicable. Listed roles alone do not grant object access.",
      "method": "GET",
      "path": "/v1/domains/{domain}/model-attempts",
      "operation_id": "models.attempts"
    },
    {
      "action_id": "models.attempt",
      "roles": [
        "owner"
      ],
      "effect": "none",
      "effect_description": "Read only; no durable application change.",
      "intent_example": "Inspecte cette tentative sans relancer le fournisseur.",
      "confirmation_policy": "authorized_user_intent",
      "object_authorization": "Service checks membership, current evidence access and personal/author scope where applicable. Listed roles alone do not grant object access.",
      "method": "GET",
      "path": "/v1/domains/{domain}/model-attempts/{attempt_id}",
      "operation_id": "models.attempt"
    },
    {
      "action_id": "models.usage",
      "roles": [
        "owner"
      ],
      "effect": "none",
      "effect_description": "Read only; no durable application change.",
      "intent_example": "Quel quota de tentatives IA reste disponible aujourd'hui dans ce domaine ?",
      "confirmation_policy": "authorized_user_intent",
      "object_authorization": "Service checks membership, current evidence access and personal/author scope where applicable. Listed roles alone do not grant object access.",
      "method": "GET",
      "path": "/v1/domains/{domain}/model-usage",
      "operation_id": "models.usage"
    },
    {
      "action_id": "conversations.create",
      "roles": [
        "owner",
        "corpus_manager",
        "contributor",
        "agent",
        "viewer"
      ],
      "effect": "personal",
      "effect_description": "Changes personal state or appends personal feedback/decision history.",
      "intent_example": "Crée une conversation sur les incidents.",
      "confirmation_policy": "authorized_user_intent",
      "object_authorization": "Service checks membership, current evidence access and personal/author scope where applicable. Listed roles alone do not grant object access.",
      "method": "POST",
      "path": "/v1/domains/{domain}/conversations",
      "operation_id": "conversations.create"
    },
    {
      "action_id": "conversations.list",
      "roles": [
        "owner",
        "corpus_manager",
        "contributor",
        "agent",
        "viewer"
      ],
      "effect": "none",
      "effect_description": "Read only; no durable application change.",
      "intent_example": "Retrouve mes conversations actives.",
      "confirmation_policy": "authorized_user_intent",
      "object_authorization": "Service checks membership, current evidence access and personal/author scope where applicable. Listed roles alone do not grant object access.",
      "method": "GET",
      "path": "/v1/domains/{domain}/conversations",
      "operation_id": "conversations.list"
    },
    {
      "action_id": "conversations.read",
      "roles": [
        "owner",
        "corpus_manager",
        "contributor",
        "agent",
        "viewer"
      ],
      "effect": "none",
      "effect_description": "Read only; no durable application change.",
      "intent_example": "Ouvre cette conversation.",
      "confirmation_policy": "authorized_user_intent",
      "object_authorization": "Service checks membership, current evidence access and personal/author scope where applicable. Listed roles alone do not grant object access.",
      "method": "GET",
      "path": "/v1/domains/{domain}/conversations/{ident}",
      "operation_id": "conversations.read"
    },
    {
      "action_id": "conversations.update",
      "roles": [
        "owner",
        "corpus_manager",
        "contributor",
        "agent",
        "viewer"
      ],
      "effect": "personal",
      "effect_description": "Changes personal state or appends personal feedback/decision history.",
      "intent_example": "Archive cette conversation.",
      "confirmation_policy": "authorized_user_intent",
      "object_authorization": "Service checks membership, current evidence access and personal/author scope where applicable. Listed roles alone do not grant object access.",
      "method": "PUT",
      "path": "/v1/domains/{domain}/conversations/{ident}",
      "operation_id": "conversations.update"
    },
    {